INFO:__main__:Loaded 10000 records from C:\Users\ibrah\Documents\AntiGravity\ConstAImvp\nigeria-ai-backend\backend\data\raw\construction_projects.csv
[I 2026-06-11 22:22:03,360] A new study created in memory with name: no-name-e812e49e-7930-4e6a-a83e-29b135692759
[I 2026-06-11 22:22:07,034] Trial 0 finished with value: 0.6640548481880509 and parameters: {'n_estimators': 473, 'max_depth': 14, 'min_samples_leaf': 8, 'max_features': 'sqrt'}. Best is trial 0 with value: 0.6640548481880509.
[I 2026-06-11 22:22:09,468] Trial 1 finished with value: 0.6456692913385826 and parameters: {'n_estimators': 456, 'max_depth': 6, 'min_samples_leaf': 8, 'max_features': 'sqrt'}. Best is trial 0 with value: 0.6640548481880509.
[I 2026-06-11 22:22:10,872] Trial 2 finished with value: 0.6685934489402697 and parameters: {'n_estimators': 210, 'max_depth': 19, 'min_samples_leaf': 10, 'max_features': 'sqrt'}. Best is trial 2 with value: 0.6685934489402697.
[I 2026-06-11 22:22:12,169] Trial 3 finished with value: 0.6482635796972396 and parameters: {'n_estimators': 226, 'max_depth': 7, 'min_samples_leaf': 9, 'max_features': 'log2'}. Best is trial 2 with value: 0.6685934489402697.
[I 2026-06-11 22:22:13,696] Trial 4 finished with value: 0.6554934823091247 and parameters: {'n_estimators': 259, 'max_depth': 9, 'min_samples_leaf': 9, 'max_features': 'sqrt'}. Best is trial 2 with value: 0.6685934489402697.
[I 2026-06-11 22:22:15,854] Trial 5 finished with value: 0.6507515473032714 and parameters: {'n_estimators': 402, 'max_depth': 6, 'min_samples_leaf': 4, 'max_features': 'sqrt'}. Best is trial 2 with value: 0.6685934489402697.
[I 2026-06-11 22:22:17,765] Trial 6 finished with value: 0.6640701071080818 and parameters: {'n_estimators': 374, 'max_depth': 9, 'min_samples_leaf': 2, 'max_features': 'log2'}. Best is trial 2 with value: 0.6685934489402697.
[I 2026-06-11 22:22:19,531] Trial 7 finished with value: 0.6441605839416058 and parameters: {'n_estimators': 373, 'max_depth': 7, 'min_samples_leaf': 2, 'max_features': 'log2'}. Best is trial 2 with value: 0.6685934489402697.
[I 2026-06-11 22:22:22,000] Trial 8 finished with value: 0.6754563894523327 and parameters: {'n_estimators': 410, 'max_depth': 17, 'min_samples_leaf': 6, 'max_features': 'log2'}. Best is trial 8 with value: 0.6754563894523327.
[I 2026-06-11 22:22:22,888] Trial 9 finished with value: 0.6494661921708185 and parameters: {'n_estimators': 199, 'max_depth': 7, 'min_samples_leaf': 8, 'max_features': 'sqrt'}. Best is trial 8 with value: 0.6754563894523327.
[I 2026-06-11 22:22:23,485] Trial 10 finished with value: 0.6708994708994709 and parameters: {'n_estimators': 103, 'max_depth': 25, 'min_samples_leaf': 5, 'max_features': 'log2'}. Best is trial 8 with value: 0.6754563894523327.
[I 2026-06-11 22:22:24,176] Trial 11 finished with value: 0.6708994708994709 and parameters: {'n_estimators': 103, 'max_depth': 25, 'min_samples_leaf': 5, 'max_features': 'log2'}. Best is trial 8 with value: 0.6754563894523327.
[I 2026-06-11 22:22:25,953] Trial 12 finished with value: 0.6721144024514811 and parameters: {'n_estimators': 294, 'max_depth': 25, 'min_samples_leaf': 6, 'max_features': 'log2'}. Best is trial 8 with value: 0.6754563894523327.
[I 2026-06-11 22:22:27,784] Trial 13 finished with value: 0.6721144024514811 and parameters: {'n_estimators': 329, 'max_depth': 20, 'min_samples_leaf': 6, 'max_features': 'log2'}. Best is trial 8 with value: 0.6754563894523327.
[I 2026-06-11 22:22:29,669] Trial 14 finished with value: 0.6728016359918201 and parameters: {'n_estimators': 299, 'max_depth': 20, 'min_samples_leaf': 6, 'max_features': 'log2'}. Best is trial 8 with value: 0.6754563894523327.
[I 2026-06-11 22:22:32,386] Trial 15 finished with value: 0.676829268292683 and parameters: {'n_estimators': 425, 'max_depth': 17, 'min_samples_leaf': 6, 'max_features': 'log2'}. Best is trial 15 with value: 0.676829268292683.
[I 2026-06-11 22:22:35,082] Trial 16 finished with value: 0.6680805938494168 and parameters: {'n_estimators': 434, 'max_depth': 15, 'min_samples_leaf': 4, 'max_features': 'log2'}. Best is trial 15 with value: 0.676829268292683.
[I 2026-06-11 22:22:38,071] Trial 17 finished with value: 0.666 and parameters: {'n_estimators': 484, 'max_depth': 16, 'min_samples_leaf': 7, 'max_features': 'log2'}. Best is trial 15 with value: 0.676829268292683.
[I 2026-06-11 22:22:40,592] Trial 18 finished with value: 0.6673575129533679 and parameters: {'n_estimators': 418, 'max_depth': 12, 'min_samples_leaf': 4, 'max_features': 'log2'}. Best is trial 15 with value: 0.676829268292683.
[I 2026-06-11 22:22:42,702] Trial 19 finished with value: 0.6686686686686687 and parameters: {'n_estimators': 353, 'max_depth': 18, 'min_samples_leaf': 7, 'max_features': 'log2'}. Best is trial 15 with value: 0.676829268292683.
2026/06/11 22:22:52 WARNING mlflow.models.model: `artifact_path` is deprecated. Please use `name` instead.
2026/06/11 22:22:52 WARNING mlflow.sklearn: Saving scikit-learn models in the pickle or cloudpickle format requires exercising caution because these formats rely on Python's object serialization mechanism, which can execute arbitrary code during deserialization. The recommended safe alternative is the 'skops' format. For more information, see: https://scikit-learn.org/stable/model_persistence.html
[I 2026-06-11 22:23:06,772] A new study created in memory with name: no-name-8417b7ed-40b6-4bce-9bf4-58cd42080047
[I 2026-06-11 22:23:33,289] Trial 0 finished with value: 0.6276849642004774 and parameters: {'n_estimators': 196, 'max_depth': 9, 'min_samples_leaf': 9, 'learning_rate': 0.23231675325968135}. Best is trial 0 with value: 0.6276849642004774.
